{
  "schema": 1,
  "id": "mtg-commander",
  "version": "1.0.0",
  "name": {
    "en": "Magic: The Gathering — Commander"
  },
  "description": {
    "fr": "Magic — format Commander (40 PV, poison, énergie, expérience)",
    "en": "Magic — Commander format (40 life, poison, energy, experience)",
    "es": "Magic — formato Commander (40 vidas, veneno, energía, experiencia)",
    "pt": "Magic — formato Commander (40 de vida, veneno, energia, experiência)",
    "ru": "Magic — формат Commander (40 жизней, яд, энергия, опыт)",
    "zh": "万智牌 — 指挥官赛制（40 点生命、中毒、能量、经验）",
    "ja": "マジック — 統率者戦（ライフ 40、毒、エネルギー、経験）",
    "ko": "매직 — 커맨더 포맷 (생명 40, 독, 에너지, 경험)",
    "hi": "Magic — Commander फ़ॉर्मेट (40 जीवन, ज़हर, ऊर्जा, अनुभव)",
    "ar": "Magic — صيغة Commander (40 نقطة حياة، سم، طاقة، خبرة)"
  },
  "icon": "MTG.png",
  "author": "Regis Conchon",
  "players": {
    "min": 2,
    "max": 6,
    "default": 2
  },
  "counters": [
    {
      "id": "life",
      "name": {
        "fr": "Points de vie",
        "en": "Life points",
        "es": "Puntos de vida",
        "pt": "Pontos de vida",
        "ru": "Очки жизни",
        "zh": "生命值",
        "ja": "ライフ",
        "ko": "생명점",
        "hi": "जीवन अंक",
        "ar": "نقاط الحياة"
      },
      "icon": "heart-outline.svg",
      "initial": 40,
      "min": 0,
      "max": 999,
      "loseAt": 0,
      "primary": true,
      "color": "#e74c3c",
      "step": 1,
      "bigStep": 5
    },
    {
      "id": "energy",
      "name": {
        "fr": "Énergie",
        "en": "Energy",
        "es": "Energía",
        "pt": "Energia",
        "ru": "Энергия",
        "zh": "能量",
        "ja": "エネルギー",
        "ko": "에너지",
        "hi": "ऊर्जा",
        "ar": "الطاقة"
      },
      "icon": "flash-outline.svg",
      "initial": 0,
      "min": 0,
      "max": 999,
      "color": "#f39c12",
      "step": 1
    },
    {
      "id": "poison",
      "name": {
        "fr": "Poison",
        "en": "Poison",
        "es": "Veneno",
        "pt": "Veneno",
        "ru": "Яд",
        "zh": "中毒",
        "ja": "毒",
        "ko": "독",
        "hi": "ज़हर",
        "ar": "السم"
      },
      "icon": "skull-outline.svg",
      "initial": 0,
      "min": 0,
      "max": 10,
      "loseAt": 10,
      "color": "#27ae60",
      "step": 1
    },
    {
      "id": "experience",
      "name": {
        "fr": "Expérience",
        "en": "Experience",
        "es": "Experiencia",
        "pt": "Experiência",
        "ru": "Опыт",
        "zh": "经验",
        "ja": "経験",
        "ko": "경험",
        "hi": "अनुभव",
        "ar": "الخبرة"
      },
      "icon": "MTG-planeswalker.svg",
      "initial": 0,
      "min": 0,
      "max": 999,
      "color": "#f39c12",
      "step": 1
    }
  ],
  "chronometer": {
    "enabled": false,
    "defaultSeconds": 0
  }
}
